### DISCUSSION TITLE
Connection to Powermeter (shelly pro3em)

### DISCUSSION THREAD

**Discussion by basti122303** [tomquist/AstraMeter#341] [General]
Hello,
I try to connect my B-2500-D battery to the AstraMeter.
I emmulate a shellypro3em_new.

Powerdata are received via MQTT.
```
INFO:b2500-meter:startet b2500-meter application
INFO:b2500-meter:Device Types: ['shellypro3em_new']
INFO:b2500-meter:Device IDs: ['device-1']
INFO:b2500-meter:Skip Test: False
INFO:b2500-meter:Starting health check service...
INFO:b2500-meter:Health check service started on 0.0.0.0:52500
INFO:b2500-meter:Health check service started successfully
INFO:b2500-meter:Connected with result code Success
INFO:b2500-meter:Successfully fetched MqttPowermeter powermeter value (filter 0.0.0.0/0): 170.963127W
INFO:b2500-meter:Shelly emulator listening on UDP port 2220...
```

```
tcpdump -ni any port 2220
tcpdump: data link type LINUX_SLL2
tcpdump: verbose output suppressed, use -v[v]... for full protocol decode
listening on any, link-type LINUX_SLL2 (Linux cooked v2), snapshot length 262144 bytes
11:34:00.934120 enp3s0 B   IP 192.168.xxx.28.10000 > 192.168.xxx.255.2220: UDP, length 50
11:34:00.938859 enp3s0 Out IP 192.168.xxx.30.2220 > 192.168.xx.28.10000: UDP, length 136
11:34:03.765886 enp3s0 B   IP 192.168.xxx.28.10000 > 192.168.xxx.255.2220: UDP, length 50
11:34:03.768204 enp3s0 Out IP 192.168.xxx.30.2220 > 192.168.xxx.28.10000: UDP, length 136
```
tcpdump looks good but in the app it cant connect to power meter.

via mqtt i get the following:
```
p1=0,p2=0,w1=1,w2=0,pe=100,vv=116,sv=6,cs=0,cd=1,am=0,o1=0,o2=0,do=90,lv=40,cj=1,kn=2240,g1=0,g2=0,b1=0,b2=0,md=1,d1=1,e1=0:0,f1=23:59,h1=800,d2=0,e2=0:0,f2=23:59,h2=80,d3=0,e3=0:0,f3=23:59,h3=80,sg=0,sp=40,st=0,tl=15,th=15,tc=0,tf=0,fc=202409090159,id=5,a0=100,a1=0,a2=0,l0=0,l1=0,c0=255,c1=9,bc=0,bs=0,pt=0,it=0,m0=0,m1=0,m2=0,m3=0,d4=0,e4=0:0,f4=23:59,h4=80,d5=0,e5=0:0,f5=23:59,h5=80,lmo=1611,lmi=295,lmf=0,uv=107,sm=0,bn=0,ct_t=4,tc_dis=0,ws=-67,fktc=0
```

**Comment by c00LhaNd86** [comment]
do you see the shelly in the app ? tryed to use _old for port 1010 instead 2220? or shellypro3em without _old/_new for both ports?

**Comment by basti122303** [comment]
the battery seems to send on port 2220 as in the tcpdump.
the shelly is offline in the app
